{
  "user_id": "session_20172de9",
  "timestamp": "2025-08-13T04:48:59.659878",
  "user_request": "I want to spend 5 days in Ukraine, visiting Poltava and its surrounding countryside. I enjoy exploring historical battlefields, tasting traditional Ukrainian dumplings, and learning about Cossack heritage. Traveling in October with a modest budget.",
  "trip_duration": "5 days",
  "destinations": [
    "Poltava",
    "Cossack Lands"
  ],
  "preferences": [
    "General sightseeing"
  ],
  "budget": "Budget-friendly",
  "travel_style": "Cultural",
  "days": [
    {
      "day": 1,
      "city": "Poltava",
      "activities": [
        "Arrival in Poltava",
        "Check into your accommodation",
        "Lunch at Puzata Hata",
        "Visit the Poltava Battle Historical Museum",
        "Stroll through the White Arbor and Round Square",
        "Dinner at Kozachka"
      ]
    },
    {
      "day": 2,
      "city": "Poltava",
      "activities": [
        "Breakfast at your accommodation or a local café",
        "Visit the Holy Cross Monastery",
        "Lunch at a local café",
        "Explore the Poltava Regional Museum",
        "Visit the Kotlyarevsky Estate",
        "Dinner at a local spot",
        "Enjoy an evening walk in the city center"
      ]
    },
    {
      "day": 3,
      "city": "Poltava",
      "activities": [
        "Breakfast and early start",
        "Visit the Field of the Great Poltava Battle",
        "Picnic lunch on the battlefield",
        "Explore nearby Cossack villages",
        "Dinner back in town"
      ]
    },
    {
      "day": 4,
      "city": "Poltava",
      "activities": [
        "Breakfast, then head to Dykanka by bus",
        "Explore Dykanka",
        "Lunch in Dykanka",
        "Travel to Opishnya",
        "Visit the Opishnya National Museum-Reserve of Ukrainian Pottery",
        "Return to Poltava",
        "Dinner and relax"
      ]
    },
    {
      "day": 5,
      "city": "Poltava",
      "activities": [
        "Leisurely breakfast and morning walk in Gogol Park",
        "Visit the Poltava Art Gallery",
        "Last-minute shopping for souvenirs",
        "Lunch and prepare for departure"
      ]
    }
  ],
  "raw_itinerary": "### Day 1: Arrival in Poltava\n\n**Morning:**\n- **Arrival in Poltava.** Assuming you're coming from Kyiv, the most budget-friendly option is taking a bus or train. The train is more comfortable and takes about 3-4 hours, costing approximately $10-$15 USD.\n- **Check into your accommodation.** Look for hostels or budget hotels near the city center to stay close to the main attractions. Expect to pay around $20-$30 per night for a decent place.\n\n**Afternoon:**\n- **Lunch at Puzata Hata.** This is a local chain that offers traditional Ukrainian dishes at very affordable prices. Try their borsch and varenyky (Ukrainian dumplings). A meal here should cost around $3-$5.\n- **Visit the Poltava Battle Historical Museum.** Located at Shvedska Mogila St, 32, it's dedicated to the Battle of Poltava, a turning point in the Great Northern War. The museum provides a deep dive into the 18th-century conflict between Russia and Sweden, where Peter the Great's victory marked the rise of the Russian Empire as a European power. Admission is about $2. Best to visit in the early afternoon when it's less crowded.\n\n**Evening:**\n- **Stroll through the White Arbor and Round Square.** These are iconic symbols of Poltava, offering a picturesque view of the city and a peaceful place to walk as the sun sets.\n- **Dinner at Kozachka.** Enjoy traditional Ukrainian cuisine in a Cossack-themed restaurant. A hearty meal can cost around $5-$7.\n\n### Day 2: Exploring Poltava\n\n**Morning:**\n- **Breakfast at your accommodation or a local café.** Try syrnyky (cottage cheese pancakes) with coffee, approximately $3.\n- **Visit the Holy Cross Monastery.** Start your day with a visit to this serene monastery complex, which plays a significant role in Poltava’s spiritual life. No entrance fee, but donations are welcome.\n\n**Afternoon:**\n- **Lunch at a local café.** Continue sampling Ukrainian cuisine.\n- **Explore the Poltava Regional Museum.** Located at Konstytutsii St, 2, this museum offers insights into Ukraine's cultural and natural history, including Cossack heritage. Admission is around $1-$2.\n- **Visit the Kotlyarevsky Estate.** This museum is dedicated to the life and work of Ivan Kotlyarevsky, a key figure in Ukrainian literature. Admission is less than $2.\n\n**Evening:**\n- **Dinner at a local spot.** Try deruny (potato pancakes).\n- **Enjoy an evening walk in the city center,** exploring local shops and perhaps catching a street performance.\n\n### Day 3: Cossack Lands Adventure\n\n**Morning:**\n- **Breakfast and early start.**\n- **Visit the Field of the Great Poltava Battle.** Located about 10 km from Poltava, this open-air museum commemorates the battle site with monuments and exhibits. Spend the morning walking through history where Cossacks fought alongside Peter the Great. Entrance is free.\n\n**Afternoon:**\n- **Picnic lunch on the battlefield.** Bring food from a local market for a modest $5-$7 total.\n- **Explore nearby Cossack villages.** Rent a bike or take a local bus to explore surrounding villages like Dykanka or Opishnya, known for their pottery and traditional crafts. Bike rental can be around $10 for the day.\n\n**Evening:**\n- **Return to Poltava.**\n- **Dinner back in town,** trying another traditional dish like chicken Kyiv.\n\n### Day 4: Dykanka and Opishnya\n\n**Morning:**\n- **Breakfast, then head to Dykanka by bus.** The journey should cost around $1-$2 one way.\n- **Explore Dykanka.** Famous for its association with Nikolai Gogol's stories, visit the Trinity Church and other landmarks that capture the essence of Ukrainian folklore.\n\n**Afternoon:**\n- **Lunch in Dykanka,** trying local specialties.\n- **Travel to Opishnya (about 20 km from Dykanka).** This village is renowned for its pottery and ceramics. Visit the Opishnya National Museum-Reserve of Ukrainian Pottery to learn about this traditional craft. Admission is around $1-$2.\n\n**Evening:**\n- **Return to Poltava.**\n- **Dinner and relax,** perhaps enjoying a performance at the Poltava Regional Philharmonic if available.\n\n### Day 5: Leisure and Departure\n\n**Morning:**\n- **Leisurely breakfast and morning walk in Gogol Park.**\n- **Visit the Poltava Art Gallery,** if time allows, featuring Ukrainian art from the 16th century onwards. Admission is around $1-$2.\n\n**Afternoon:**\n- **Last-minute shopping for souvenirs,** such as traditional Ukrainian crafts or pottery.\n- **Lunch and prepare for departure.**\n\n### Practical Tips:\n- October is a great time to visit with fewer tourists and mild weather; pack layers as it can be cool, especially in the mornings and evenings.\n- Public transport is very affordable in Ukraine, but always have some cash as not all buses or minibuses accept cards.\n- Learning a few phrases in Ukrainian or Russian can greatly enhance your interaction with locals.\n- Be respectful when visiting religious sites; dress modestly and ask permission before taking photos inside.\n\n### Estimated Costs Summary:\n- Accommodation: $20-$30 per night x 4 nights = $80-$120\n- Meals: $10-$15 per day x 5 days = $50-$75\n- Transportation within Poltava and to nearby villages: ~$30\n- Entrance fees and activities: ~$20\n- Total Estimated Cost: $180-$245\n\nThis itinerary offers a deep dive into the rich history and culture of Poltava and its surrounding Cossack lands, all while keeping costs low and experiences high. Enjoy your journey through Ukraine!"
}